двач  где блять можно найти молоко без лактозы,0
никогда не видел  чтобы оно продавалось в пятерочках и тд,0
заебался дристать после каждого выпитого стакана протеинового коктейля,0
можно и с водой наверное бодяжить протеин  но это вроде дрисня полная,0
в мажорных магазахможет в бахеиле есть,0
бахетле,0
мимо  я не в московии живу,0
ашан  окей  лента,0
0 5% ультрапастеризованное молоко без лактозы,0
а вообще переходи на овсяное,0
просто походи по продуктовым и посмотри,0
мы  блядь  знаем  где ты живёшь  что ли,0
parmalat comfort безлактозное  примерно 100 рублей есть в ашане ленте точно,0
можно на озоне заказать,0
фу блять  я пробовал это молоко,0
дрисня,0
его невозможно куда то добавлять,0
с протеином наверное тоже получится параша,0
в пятерке дикси фикспрайсе есть немолоко  типа молоко из овсянки,0
еще вроде в магнолии видела именно безлактозное  попробуй там посмотреть,0
но мне немолоко вобще нравится  нравится больше любого молока,0
коко см,0
на 2см больше  чем у тебя,1
я бы тоже похрючил,0
кукуруза  крабы охуенно же,0
ждём нейронку на карты и богатеем всем двачем,0
это не я,0
хммммммммммм,0
а какие пароли от архивов,0
моча нахуй пиздец,0
пиздец  одни нищюки да негры юзают эти ваши андроеды,1
залетный  съеби,1
а ты уже поужинал,0
http:  gosms,0
gomocdn,0
com 59222 2017 09 11 03 22 16 gosharefile_image autocompress1505071330448,0
jpgкак остановиться листать это говно,0
какой же милашка,0
а какие пароли у архивов то,0
такие  как и всегда,0
какие охуенные волосы на 2 м пике,0
отлизали бы писечку,0
а какие вседа были,0
я д этогтне качал архивы ановъ,0
стандартный пароль,0
не тупи,0
знатный хохол,1
перепробовал кучу стандартных чтото не догоняю,0
стандартный точно работает  проверял,0
сволочь ты поганая добавь в шапку юзерскрипт,1
забей  лучше посмотри на этого собакена :3,0
какие пробовал,0
тебе его никто не скажет потому что моча банит,0
мне так на два дня прилетело как то,0
ну зачем ты так грубо  анончик,0
кок,0
догадался,0
лол,0
теперь ты олд,0
зачем ему столько баночек йогурта,0
гайд,0
есть там что нибудь интересное,0
или только нигры  старики и жирухи,1
сперма же,0
потому что уже 3 треда игнор,0
ну что  теперь у каждого анона есть купончик,0
абу был,0
в тред скидывали даже,0
сперма из банка спермы,0
упал,0
абу это конечно интересно  но уже на него не встает,0
присунул бы аутичному карлику за щеку,1
есть ящерка,0
is he consuming cum chalice,0
хуй застрял в пороге,0
как же хочется тяночку,0
кого то покромсало,0
сэкси,0
ящерке не присунул бы,0
страшно тред листать  боюсь мамку увидеть,0
в коллекцию к деду,0
этим только вайпатьможет форчану кинем и хуй забьем,0
чью,0
как же хочется тяночку,0
3 пик,0
антена для радио,0
музыкальный центр,0
бухая мать в семейниках,0
у меня флешбеки начались,0
тяночку хочца,0
могу и туда перекатить  но не знаю что там с местной мочой тут же ниггерская тема  мне кажется тереть будут,1
героям слава,0
ну так позвони и познакомься,0
уже звоню,0
что там с местной мочойв бан улетишь моментально  если на тематической доске начнёшь этим срать,0
они там рваться начнут с подобных фото,0
b  достаточно тематическая,0
b думаю стерпит,0
не вздумай в  pol это кидать,0
банхаммер работает как часы  за каждым ниггерским хуем следит,1
в б утонет быстро  перекатывай в политач или в  g,0
да бля,0
не сохраняется в папке,0
че делать то,0
чей батя,0
политач или в  g тогда через проксю  сладкий,0
на аватарке и  жизни,0
здоровья,0
1 пикмаш  ты,0
а помнишь  как мы в сосничестве бегали от проблем  боялись шорохов на стройке  как неуверенно ты брала меня за руку и так же неуверенно целовала,0
а потом мы весь новый год гуляли  пока ты не предложила зайти к тебе,0
там то и закончились наши отношения,0
начался разврат  плетки и сексмаш  ты,0
ладно  оп хую сейчас лень на форч перекатывать  если анон захочет  пусть сам перекатит,0
ое ламповое фото,0
сууука  опять ты  содомит,1
какое же форч старое и неудобное говно,0
ты ещё двач не видел,0
ты через прокси постишь,0
webm по 3 мегабайта,0
мммм,0
почему в зеркале за его спиной он отражается  как спереди,0
зеркала довен,1
блин  это ж типичное семейство из пасты,0
батя  мамка  корзиночка  только тётя срака с бонгом,0
визгнул,0
тебя ебет,0
афро славик сычев,0
йохан филип асбек,0
оффтоп,0
а почему бизнес настолько охуел что не просто сам выкладывает и пропагандирует а еще и наказывает тех кто скачивает и смотрит,0
нахуя выкладывали тогда,0
сами то не смотрели что ли,0
давайте накажем бизнес,0
я и не постил ничо  просто ридонли,0
а потом ещё говорят что всё это стереотипы,0
ну ну,0
перекатом на форч кто нибудь занялся,0
а ну ясно  я вот пытался запостить но он мне всё время ошибкивыдаёт и воспринимает это как спам,0
ага,0
кто в ниграх шарит  можете про них паст написать,1
я испоьлзовал vpn сервера в штатах,0
корм американских пидорах,1
возможно из за ссылок,0
используй dot вместо,0
обязательно напишите что силами рашан хакерс были взломаны негритянские жёппы  пока white sissi boi's дрочили на хитлу и парня которого закрыли  уже выпустили под залог   за пострелушки,1
карта еще 1 5 года назад сдохлатак не интересно,0
может впном страну сменить на асашай,0
они любят есть жаренную курицу ещё они геи  и любят срать друг другу в рот заедать всё это жареной курочкой  а потом обмазанные в говне отсасывают друг у друга,1
ну и конечно же крэк  марихуанна и т,0
п,0
а  не заметил,0
двачую,0
напишите  что если трампыня не станет королем в асашай  то и инстаграм положим,0
купил мужик шляпу  а она ему,0
на 2 няша пиздец,0
почему у всех баб такие уёбищные сиськи,1
зачем они их кому то отсылают,0
у кого на это встаёт,0
чому в приложении одни нигерши и латинки,1
гля какая,0
ууу сука  шишка колом,0
это старухи за 40 или жирные нигры,0
наелся и спит,0
запилил  побампайте пока там,0
виктор блуд,0
чыкчырык ебанулся уже да,0
оффтоп,0
a этим кто то еще кроме двача занимается,0
просто странно что у нас тут мамкины программисты что то начали делать а не взяли прогу у западных прогеров,0
сразу видно листву который сиськи видит только в порно,0
когда тебе твоя личная собственная тянка или жена кидает сиськи тебе похуй что они не идеальны ты ведь любишь ее всю,0
аухеть  скриллекс,0
тут делать то нечего  только ленивый не может парсер этого говна написать,0
пик отклеился,0
любимая еда ендерменов,0
мне она же попадалась,0
а где упоминание ру хакеров,0
бля  я там надолго забанен за ниггерские хуи в пораше,1
сразу видно командира футбольной команды,0
блять  а потом ты берешь их в руки,0
почему так много хуев и сисек  они только так и общаются,0
что он сосет,0
если на русском написать все это   то будет ещё кринжове,0
даже конченые дауны так не общаются на русском,1
ребенок  нахуя мужу фото сисек жены,0
сиськи интересны только до ебли  потом уже насрать хоть очко разъебанное сразу видно листву который сиськи видит только в порно,0
нихуя проекциямимокрок,0
прямо очень нескрепно  прямо вот чувствую как скрепы трещат,0
там зумерши есть или только бабки,0
напомни сам  чё,0
нихуя не сохраняет,0
вроде парсит  а в папке пусто,0
блять  а потом ты берешь их в рукипереходи на бесконтактные способы оплаты  вдруг хуй болен коронавирусом,0
ни одной зумерши я думал там будут залежи цп  а там только старухи и нигры,0
цп нет,0
хароший скрыпт  но все черное,0
вдогонку,0
дали анону дырявый сервисанон нихуя не накопалкроме всратых вагин и сисек нигеровзаебись контент уровня \б\это как в сортире залезть в ведро со сральной бумагой,1
объясните  почему там одни негры  и в целом все выглядит как наш родной русский быдлотред,1
это какая то приложуха для нищеты,0
быстрофикс,0
черное в смысле негров,1
или просто место фото все черное,0
если так  то впн включи  у меня без него через 10 страниц перестали фотки показываться,0
сохраняет в папке  в которой запустил скрипт,0
спс за совет  анон,0
мимо другой ловец черного,0
что значит  errno 2,0
нету трыщь майор,0
просто именно так всё и выглядит  красивые буклеты описывали лишь социум идентичный натуральному  нужно сноски читать не забывать,0
в том то и дело  что в папке остается пусто,0
еще попробуй когда не показывает фотки  перейти на страницу вперед  потом назад  все начинает снова работать,0
да не майор я,0
копай лучше,0
может найдешь,0
ребенок  нахуя мужу фото сисек жены,0
сиськи интересны только до ебли  потом уже насрать хоть очко разъебанноетем не менее  шлют  и мужья для жен мастурбируют  раньше в российских файлообменниках много таких было фото и видео  где мужья писали или говорили  что это для жен и наоборот,0
небось  черной девушке послал,0
ты про скрипт на go,0
такая же хуйня у меня  он парсит  но не сохраняет,0
у меня заработал только 3 й скрипт из шапки,0
ну и для тамперманкей скрипт работает,0
чёрному парню,0
async кун охуевший скрипт сделал и уже внедрил nudenet для детекта nsfwимею предложение добавить сортировку самого nsfw контента по папкам  этот самый nudenet это умеет,0
сам я ленивое хуйло и не разбираюсь  может когда то потом сам попытаюсь,0
нахуя брить яйца и не брить пузо и ноги,0
это же выглядит пиздец стремно,0
чёрному парню,0
может быть,0
нахуя брить яйца и не брить пузо и ноги,0
потому что это ты идёшь ебать  а не тебя,0
для этого уже есть готовые сортировщики,0
ну наверное если ты в бане там или в раздевалки то кто то увидит что ты брил какого то хуя пузо а так типо ты для себя но и остальным показываешь что ты не пидорок,0
сортируй ниггерские хуи в левую папку  а жирные чёрные вагины в правую  нахуй тебе неты там какие то,1
всё равно другого нюда там нет,0
тогда зачем брить яйца,0
контент,0
так а зачем они смотрят на мои яйца и пузо,0
они не пидорки часом,1
потому что тянка захочет и их пососать во время заглота твоего удава  сынок,0
кокой сладкий,0
ну они случайно посмотрят и будут думать о тебе как о голубом боичике и  все с тобой ясно   будет отношение уже будет не такое наверное,0
где там 3 скрипта для го,0
а если она захочет полизать мою дырочку,0
мне ее брить или нет,0
большая любовь на 3 и 4 пиках,0
а если я у них отсосу  что тогда они подумают,0
й скрипт на питоне  он у меня и заработал,0
ещё скрипт на питоне:,0
вам ебля из приватных чатов нужна что ли,0
в осле вбиваете whatsapp sex porn fuck и тд,0
вместо ватсаппа подставляйте что нужно snapchat и прочее,0
если ты бреешь анус  то скорее всего его не будут лизать,0
подумают что ты геи и попросят тебя не ходит в качалку тк там только гетеросексуальные ребята,0
это другое,0
сам ты осел,0
да  видел там детектор,0
самый пиздец,0
доку на инглише для  b ратьев из загнивающих и не только,0
анон с юзер скриптом  про тебя и в треде не форче забыли,0
руками,0
кто нибудь пробовал открывать битые картинки,0
хз что с ними делать,0
это вроде как из  секретных чатов  и там нужен какой то access_key,0
вкину няшу  заебало смотреть на гнилые пезды и черные хуи,1
я нихуя не понимаюerror: microsoft visual c   14,0
0 or greater is required,0
get it with  microsoft c   build tools :error: command errored out with exit status 1: 'k:\games\pyton\python,0
exe' 'k:\games\pyton\lib\site packages\pip\_vendor\pep517\_in_process,0
py' prepare_metadata_for_build_wheel 'c:\users\lok\appdata\local\temp\tmp6_pvms46' check the logs for full command output,0
какая то зависимость не может установиться,0
microsoft visual c   14,0
0 есть,0
у тебя там должна в консоли будет выползти строка начнет обновления питона  и там будет указана команда как это сделать,0
вот когда сделаешь  эта хуйня с vb пропадет,0
топ,0
ну если она должна быть в программах и компотентах то её нет у меня визуал есть с 2005 по 2019 но я не вижу в названии 14,0
палю годноту,0
ебать  нахуя это скрипту на питоне,0
попробуй заинсталить вот этуй хуйню microsoft c   build tools  там будет пункт насчет python  выбери его,0
хули на 2 3 фото людоеды ебаные,0
есть слив наташек,0
палю годноту,0
еслиб чел,0
а так это раковая приложуха для негров там няш милаш меньше процента,1
майкрософты пидорасы суют свою парашу везде,1
так это не питону  это нейронке  которая в код засунута  надотолько ее можно было через докер накатывать  так что я не понимаю зачем все это сделано,0
до чего же негритоски всратыеа белые вообще этой хуетой пользуются,1
так нейронке то нахуя билдтулзы ебать   ей только рантайм если только нужен   либо нужно версию нейронки выбрать под распространенный рантайм на вин7 10  либо подкинуть дллку рядом нужную,0
билд тулзы это если юзер будет конпилидровать вашу нейронку из исходников лол,0
идеально,0
интерпретатор на c написан,0
с первой проебался,0
2недавно эта пизда в ок камвхорила пока не забанили лол,0
питон то,0
ы написал и описывается понятикм 'минимальные софтскилз'  дубинушка,0
в рашке в обще то,0
с чего ты взял  что он только с абибасами корешится,0
хоть и не работают уже хз сколько  но чёт взбесила ваша хуйня,0
хр самая тупая профессия  днищее наверно нет,0
сидят дауны прочитавшие пару книг и считают  что они ниибаца спецы  прям с порога физиогномикой своей всё считывают,1
помню как работал  там тоже такие сидели  как тут в треде и пизда на вебм,0
не могли сотрудника найти  набирали типичных нормисов  которые к 11 приходили в 17 уходили  работали на отъебись,0
но зато жена детки хули всё как у людей,0
каждый hr кароче конченный дегенерат,1
случайное стечение обстоятельств,0
на самом деле существует множество конфигураций люков которые не круглые,0
конкретно круглыми их делают потому  что такая форма люка забита на линии которая их шлепает,0
конкретизируйте вопрос,0
только если ты хохел  анимедаун или говноглаз,1
нет  дубинушка,1
минимал   это соответствующие минимальным требованиям  а не днищё ёбаное,1
это еще почему,0
а как еще скотоублюдию называть,0
ну не знаю чувак  я понимаю конешно  что поцик с  челочкой  на фоне ковра может быть даже анимешником  но скорее всего он обычный  нормальный пацан,0
просто тут имеет место быть первое впечатление  которое редко бывает обманчивым,0
украшка,0
в пидорашке вообще то,1
я видел  как подобные лидеры сдувались,1
это забавно и смешно,0
быть лидером в школе или институте   это не показатель,0
много денег   не показатель,0
в миг можно опозориться на всю жизнь,0
двачую,0
скотоблевотия  хуйлостан  оккупационная свинопедерация  пынявые вымираты,1
вот чтоьы не было всего того что ты написал   это и есть минимальные требования,0
hr   раковая опухоль любой компании,0
дейли цель,0
почему ты не написал  ежедневную цель   гидроцефал,1
ток не надо оправдываться профессиональной непереводимой терминологией  ее тут нет,0
полизал тебе яичьки,0
библиотекарь  ты,0
так я же сам с рашки  мне в обще до пизды на украху,0
ссорян  не в ту сторону повоевал,0
hr девочки в подавляющем большинстве своём   это не профессиональные психологи,0
всего лишь максимум бывшие студентки психологических специальностей  которые  прочитали пару книжек и шикарно разбираются в людях,0
да  конечно  в крупных конторах на хороших зарплатах сидят прекрасные специалисты в своем деле  но если ты идёшь на собес в средненькую конторку  будь готов встретить обозленную на весь мир 36 летнюю маринку  которая уже со старта тебя ненавидит,0
то что в айти одни додики прогерс   миф,0
