самый большой процент разводов в мире справедливости ради   больше браков   больше разводов,0
животное  ты когда значение слова процент проебать успело,1
ок   ожидать способности мыслить от сторонника похода в загс в этой стране не приходится  но не до такой же  блядь  степени,1
а реальность такова   всем похуй  ничего не происходит  харча не прилетает в затылок,1
ага  челик на видосе тоже так думал,0
работал  приносил тянке деньги  думал что у него всё хорошо,0
а что по итогу вышло можешь сам посмотреть,0
льготная ипотекаэто когда ты из 50 тысяч платишь 15к за квартиру  которую:1 быстрее погасить одному  ибо можно закидывать 30к пусть и не каждый месяц2 поделится в случае развода от которого никто не застрахован3  детей хуй выселишь без разрешения матери которое она тебе хуй даст налоговые вычетычто мешает тебе сделать это одному,1
наследствокакое,0
кому,0
куда,0
ты очевидно никогда не жил с женщиной и не понимаешь  что это огромный тормоз во всех смыслах,1
у тебя какое то искаженное представление о девушках,0
прям женоненавистническое,0
не хочу разводить спор на эту  ибо не преследую сейчас цели тебя в чем то переубедить,0
однако  попытаюсь продолжить обсуждение данный темы следующим вопросом:  в связи с какими событиями  произошедшими в твоей жизни  ты сделал для себя подобные выводы,0
ведь не просто так  с нихуя  ты вдруг решил  что абсолютно все тянки  без исключения   гнилые срази,1
не понял твоей агрессии,0
я о том  что что в других странах может быть больше отношений  расторгнутых без брака,0
подписка о невыездеэта хуйня страшнее в несколько раз,1
знаю этого чела  он её простил и дальше вместе живут,0
в стране дефицит женщин,0
это старая паста  анон  ты прав  её обоссывают каждый раз в таких тредах,1
покажи пизду,1
мне нравится ебать собак  человеки нинужны,1
в стране дефицит женщин,0
только в манямирке омежек и инцелков,1
кек  ну лох должен страдать,1
тогда этот тред не для тебя,0
к слову 245 ук рф  долбаеб,1
возрастнополовую пирамиду смотри,0
дефицит мужчин у нас после 5,0
о  лох пытается надавить на совесть жене   шлюхе,1
каеф,0
тряпки должны страдать,1
что я тебе такого сделалахахахахаа,0
ты какой то бот низкосортный,0
либо тухлодырая  что вероятней,1
твой высер никак не опровергает тезис о проценте развода,1
но в то же время он противопоставлен ему,0
более того то пояснение которое ты дала мы должны были чтением мыслей угадывать  да,0
1 быстрее погасить одному  ибо можно закидывать 30к пусть и не каждый месяцнет  если оба работают и платят поровну,0
2 поделится в случае развода от которого никто не застрахованзастрахован  если ипотека оформлена на твоих родителей,0
3  детей хуй выселишь без разрешения матери которое она тебе хуй дастесли прописать мать в своей квартире,1
моя тян прописана у своей мамки и если что поедет туда,0
что мешает тебе сделать это одному,0
разговор о брак vs сожительство,0
при сожительстве я не смогу оформить налоговый вычет для тянки  которая не работает работает неофициально  и наоборот   таким образом  семейный бюджет страдает,0
какое,0
кому,0
куда,0
имущество  приобретённое после развода,0
наследниками первой очереди в таком случае будут новые жена и дети   на тот случай  если ребёнок не твой,0
чел  о каком дефиците женщин ты говоришь  если границы открыты и ты можешь найти себе тян в любой другой стране  кроме скотоублюдии,0
тебе 4ккк тян мало,0
оба работают и платят поровну,0
пиздец  анон,1
если ты не успешный кабанчик  ты и так никогда не женишься,0
всем тянкам нужны бабулесы,1
если ты обычнокун работяга  не о чем волноваться,0
все кореша которые поженились  они успешные  ездят на авто  имеют свой угол  не нуждаются в деньгах,0
в любой другой стране тоже дефицит,0
из какой страны ты её вывозить собрался,0
что заставляет людей жениться,0
одиночество и неспособность обустроить свою жизнь одному  например,0
мне вот маман постоянно говорит:  ой да не женисб рана надо нагулятца    но при этом я только бухаю в компании пк и кота и дрочу на аниме  когда не учусь и не работаю,0
то есть  по хорошему найди я удовлетворяющую меня тян   очень даже был бы готов жениться на ней,0
да и смешно слушать поддакивания от бати  у которого кроме мамки отношений серьёзных не было  и вряд ли много случайных связей,0
а ты планочку снизь,0
баба после 30 сама тебя потащит в загс  а рсп и моложе найти можно,0
у меня мамка в 2 раза больше бати алкаша зарабатывает  лол,0
знакомые амеры себе жён из азии напривозили в сша и рады  местный неликвид дико орёт,0
знакомые из рашки себе из той же азии везут тян  по сравнению с местными кунами даже сыч с харкача это овердохуя успешный челик,1
и тян  в отличие от натрашки не хуеет  потому что знает что ты её тупо выбросишь как щенка на помойку и всё,1
ну в европе тоже есть страны где норм тян можно найти,0
снг это днище по качеству тян  все иностранцы мне сказали что хуже чем рюзке тян в мире нет  самые токсичные  мерзкие  жадные  охуевшие  тупые  меркантильные,1
нужно быть совсем ёбнутым  чтобы на рюзке шлюхе жениться и вообще с ней мутить,1
нет  если оба работают и платят поровну,0
охуительные истории пили еще застрахован  если ипотека оформлена на твоих родителей,1
то есть ты в первом пункте предлагаешь заставить женщину отдавать ровно половину своих доходов на квартиру но не хочешь оформить ее на своих родителей,0
ну это возможно если ты ненавидишь свою бабу и хочешь ее кинуть иначе хуй кто тебе позволит такое провернуть разговор о брак vs сожительство,1
при сожительстве я не смогу оформить налоговый вычет для тянки  которая не работает работает неофициально  и наоборот   таким образом  семейный бюджет страдает,0
