на самом деле в биг корпорейшнс и успешных стартапах сидят социализейшен гайс и герлс,0
зашуганный dude из под маминой юбки в такой corporation донт нидед,0
он кэннот инто общение с лидом и тимой,0
от него не будет фидбека,0
а на спринтах во время митингов эври морнинг он кэнт ставить себе дейли таргет,0
мост импортант скилл ин эври профешн  а тем более приближенной к бизнессу   это софтскилы,0
имхопофиксил тебя  дегенерат,1
вот тупая  блядь,1
айтишник по умолчанию должен быть ебнутым на всю голову,0
если он не ебнутый значит это очередной вкатывальшик  который нихуя не знает,0
ковер  визитка  блядь о чем это,0
человек который прочитал на порядок больше технической литературы  чем эта дура прочитала детективов за свою жизнь  который управляет системами которые ебашат миллионы транзакций в минуту или разрабатывает многомерные функциональные структуры которые держит только в своем воображении  может на фото хоть хуй выложить и все равно за ним выстроится очередь,0
ковер ей не нравится  блядь пиздец,0
значит  ты биомусор ненавидящий свою родину,1
бич плиз,0
бикоз это профжаргон,0
вот если б знаменые дядьки в свое время не убили в скотопидорке ойти говорили бы  по русски   а так   не выебывайся и понимай как умные люди говорят  собака  раз своих мозгов в башке нет,0
а как можно разбираться в людях  не повидав жизнь  не побывав в серьёзных ситуациях,0
для бизнеса это не нужно  это я про психологию,0
сосалка перекладывающая бумажки чему то кого то учит там,1
охуеть блять,0
хуя у омежки багор,1
300в секунду получаешь  а ковёр на картину пикассо поменять не можешь,0
зато омежка работает за двоих,0
у него работоспособность несколько больше  чем у социобляди  которая по клубасикам и прочему говну ходит,0
мир не черно белый,0
он не состоит из глупых социоблядей и умных  но отвергнутых омежек,0
обычно  именно социоблядь более интересен как личность,0
работы обычно немного,0
гораздо важнее взаимодействие между командой и фидбек,0
я бы наоборот только омежек и бралвот когда будет своя компания  тогда и бери,0
он не вольется в коллектив чел с челочкой граблями на фоне ковраокружение формирует сознание и наоборот,0
если человек живет в такой обстановке и так к себе относится  то это говорит об его уровне,0
нет  он не вольется в интеллигентную среду,0
аноны  хватит жить в плену иллюзий,0
непонятый интеллектуал в засраной одежде и без социальных связей   это миф,0
таких один на сотню,0
остальные 99%   это в лучшем случае бесполезные для большой компании люди,0
одно дело  когда весь отдел программистов из 1 2 человек  другое   когда одна или несколько больших команд  где важную роль играют личные качества,0
имплаинг что среднекун альфач,0
опытные программисты  которые руководят этими it конторамиит конторами редко руководят программистымимо в ит с прошлого века,0
профжаргон наш русский у нас на производстве на цеху у мастеров с 3 разряда  у тебя скотопидорство жополизное подпендосное гнойное и выебоны пидорские,1
ит конторами редко руководят программистытем не менее эти люди как правило в курсе разного айтишного движа,0
а если контора это наколенный стартуп то очень даже могут быть и программисты сами,0
помню мне hr мужик мозги на собезе в 2х этапах ебал  я два тестовых теста делал  2 раза  сука  приехжал к ним в офис  до того как меня к тимлиду подпустили,0
как итог   меня завалили вопросами уровня   какие индексы нужны в olap и oltp системах  меня  на тот момет джуна,0
хорошо что хоть ещё один офяер на руках был  иначе бы я там ёбнулся  лол,0
основная проблема в том  что джуны рано или поздно становятся мидлами,0
и потом хуй они пойдут в такие компании,0
зашкварище идти работать в контору где есть специальный hr,0
это корпоративная галера стопудов  где работника ни во что не ставят,0
мастеров с 3 разрядау мастеров разряды есть,0
поменял ковер на хуй тебе за щеку,0
профжаргон наш русский у нас на производстве на цеху у мастеров с 3 разрядалал,0
ну хуярьте там на своем жаргоне,0
я ж тебя не учу болты крутить  ты не пытайся меня учить на дейли митингах селфпрезентации и ретроспективы проводить,0
наколенный стартупэто да  но наколенный стартап не использует hr шлюх,0
а я и не против,0
бля  ребят  есть инсайд с брифинга в мейле,0
они проводили рисерч на фокус группах,0
есть реальный деманд у пользователей  но какой пока секрет,0
у меня по теме четкий вижн  кофаундер оч сильный продакт с бэкграундом в фанд  рейзинге,0
ворк флоу прописан,0
ищу дизайнера  чтобы запилить первый кейс в эмвипи,0
дедлайн — вчера  так что реальный челлендж прокачаться в скорости,0
если с фидбека ловим вау — эффект  то идем в диджитал медиа  набираем вэлосити и становимся ключевым вендором этой хуйни на рынке,0
деманды по кипиай уже есть  на запуске режем косты  так что платить не смогу,0
как только закроем чек пойнт с эккаунт планированием сразу пойдут бабки,0
вероятность факапа минимальна,0
го,0
ты не пытайся меня учить на дейли митингах селфпрезентации и ретроспективы проводить,0
в воскресенье в антикафе  коузи митинг  был проведен коворкинг среди эмбеддеров  qa и просто айтишников,0
коворкинг состоял из нескольких частей: воркшоп с перерывами на кофе брейки  кстати были вкуснейшие маффины с ванильным кремом  а также безалкогольный мохито и смуззи  и выступления докладчиков   стартаперов со смелыми краудфандинговыми проектами,0
общая аудитория состояла из специалистов довольно широкого круга: здесь мы видели как новичков в коворкинг центре  так и знакомых нам по прошлым встречам людей,0
воркшоп состоял из тренингов по применению облачных технологий в системах умный дом  использованию там искусственного интеллекта и обучающей модели для самонастройки системы,0
информация была интересна как людям  напрямую работающими с эмбеддед по  так и просто девелоперам и специалистам qa,0
далее была самая вкусная часть  а именно: доклады стартаперов  которые уже стабильно стоят на ногах и готовы продвигать свои креативные идеи в наш быт,0
стоит отметить почти четырехчасовой доклад с презентацией дизайнера и профессионального фотографа ивана сурикомова,0
иван известен нам по уже описанному ранее краудфандинговому проекту выключателя света на платформе arduino,0
смелые бизнес идеи  отличная задумка  мощная hardware поддержка   всё это про систему ивана,0
публика активно задавала вопросы  в ходе показа презентации иван детально описал своё устройство,0
инновационность заключается в том что длявыключения и включения освещения вам не нужно переключать выключатель,0
вся прелесть конструкции ивана в простоте и юзер френдли интерфейсе,0
подумайте только   свет управляется одной кнопкой  причем она сама запоминает свое состояние  словно включение системного блока стандарта atx,0
к тому же  кнопка повторяет форму пальца человека,0
из презентации сурикомова стало ясно  что подобных проектов в мире пока что не было,0
иван разработал трехмерную модель кнопки и продемонстрировал ее в презентации,0
на данный момент мой проект находится на стадии прототипирования и просчетабизнес идей    сказал сурикомов,0
модель кнопки в будущем будет распечатана на 3d принтере у ребят в фап лабе  для этого накикстартере ивану нужно собрать всего лишь $21 000,0
увы  пока что ивану не удалось совместить работающий макет своего устройства с реальной лампочкой  по словам ивана для управления лампой используется опасное высокое напряжение в 220в  а выводы arduino выдают 5в,0
но ничего  hardware специалисты будут разрабатывать блок для управления высоким напряжением,0
возможно мы применим трансформатор для преобразования 5в в 220в    отметил иван в завершении доклада,0
не обошло наше мероприятие и представительниц прекрасного пола  помимо знакомой нам с прошлых встреч ираиды сандро  сегодня выступила новая девушка из хакерспейса по имени елена,0
ее доклад тоже был принят с вниманием и интересом  ведь елена затронула очень актуальную тему на сегодняшний день   печать больших объектов на 3d принтере,0
в частности  елена продвигает идею печати стульев и пуфиков и даже продемонстрировала залу модель своего будущего стула  всего 7см в высоту,0
елена намерена набрать нужную сумму для воркшопа с помощью иностранной стартап кампании с краудинвестингом в основном из сша,0
к тому же  елена разработала смелое дизайнерское решение надеть картонную коробку на раму велосипеда,0
я давно думала о таком велосипеде  ведь никто до меня этого не сделал    заявила девушка,0
нельзя сказать что все выступления в антикафе были интересны публике: под вечер двое ребят пытались рассказать о построении каких то антенных систем на основе дешевых китайских тв тюнеров,0
публика отметила что проект пока что очень сырой и требует доработок  а также в нем изюминки  нет элементов хайтек стартапа,0
но слушатели предложили применить тв тюнер для управления вебкамерой в квартире с возможностью стрима через веб интерфейс,0
ваня сурикомов даже сказал что готов купить такое устройсто  если оно будет вести стрим на его iphone 9,0
на второй не ероха   обычный работяга  просто сфоткался не уебищно  насколько это возможно   просто норм,0
ну а что  современная практика hr представителей,0
мужики глянь  патриот ебаный нарисовался,1
оторый управляет системами которые ебашат миллионы транзакций в минуту или разрабатывает многомерные функциональные структуры которые держит только в своем воображениивряд лм будет выглядеть на фотке как уебан,0
ни кармак  ни гейтс не выглядят как скотопидорашье быдло,1
оба программисты  оба неплохо получают,0
да  скорее всего чуваки не выглядят как супермодели  но и не выглядят как бомжи вроде перельмана  который реально может пояснить за многомерную хуйню,0
потому что очень много англицизмов в айти впринципе,0
50% работы это работа с англоговорящими,0
все гайды  курсы  решения проблем  тематические форумы и чаты на английском,0
я не против говорить на русском языке  дело в том  что даже русскоговорящие предпочитают говорить  спринт  чек  трейни  курс    засольви проблему   дейли  митинг  коллаб  рефьюз  и это те слова что вспомнил сразу  их очень много,0
омежка бомбит от правды,0
любо дорого смотреть,0
даже русскоговорящие предпочитают говорить  спринт  чек  трейни  курс   засольви проблему   дейли  митинг  коллаб  рефьюз это только среди даунов аутистов вроде омежек программистов,1
по твоему описанию лид должен целыми днями только горшки за джунами менять и спрашиваться о том  может он сегодня с коллегами пообщаться или не может,0
решить вопрос увольнением   не сложно,0
проблема в том  что вначале нужно человека нанять  потратить на него время и деньги  а уже потом уволить,0
и это все ебать как дорого,0
намного проще выявить этот риск сразу и не нанимать вообще,0
так да  это минимальный набор,0
но если человек не в состоянии решить проблему  пройти хр скрининг   то этим минимумом он не обладает,0
по первой ссылке в гугле можно прочитать  какие фотки нужно вставлять в сиви,0
то есть ему либо совершенно похуй  либо он совершенно отбитый,1
ты прав в том  что на начальной позиции софт не так важен,0
софт развивается со временем в том числе,0
но он развивается у тех  кто хочет его развивать,0
если в 25 лет у человека софт скилз на уровне деревенского вани  который людей в глаза не видел  то это значит  что он не хочет и не будет его развивать,0
и уж они наверное что то понимают в том  каких именно кадров нужно нанимать к себе в фирму,0
как показывает опыт   нет,0
но в принципе уметь соответствовать социальной адекватности   это хорошее требование,0
в it всегда были и будут 90% всякий скам  омежки  женатики на всратках  немытые чуханы  жирдяи  просто миллионы жирдяев,1
что такое спринт,0
неосилятор детектед,0
хуя жиробаса порвало,1
но в принципе уметь соответствовать социальной адекватности   это хорошее требование,0
я спортик ваще,0
в рот ссал этим вонючим жиробасам,1
когда работал в айти охуел со скама,0
я в отделе один был на человека похож,0
остальные буквально воняли ссаками и даже говном один,0
цель: найти омежек через пробивобъяснить им что их унизилиподать в суд на хр,0
написал в резюме  что hr шлюхи   было 3 отклика в месяц,0
убрал   стало 125,0
хуй знает  пацаны,0
кстати  да,0
пиздень  которая считает себя спецом  которым конечно не является  занимается такой неэтичной хуйнёй,1
нужно его затравить,0
ну так правду никто не любит,0
по твоему описанию лид должен целыми днями только горшки за джунами менять и спрашиваться о том  может он сегодня с коллегами пообщаться или не может,0
по моему описанию  лид должен уметь анализировать поведение членов его команды и если что то не так работает как ему кажется должно   пытаться исправить,0
это означает  что он должен знать кто из его команды на что способен и с какой скоростью способен справляться с задачами,0
а для этого он должен  внезапно  общаться с этими людьми,0
и это поведение не только джунов касается   если мидл или какой нибудь другой сеньер помидор  звездят  или  быкуют  это тоже не очень хорошая ситуация,0
в твоей интерпритации тим лид это что,0
чем он по твоему должен заниматься,0
закомплексованнный омежка с большой вероятностью ненадежен,0
как человек  он может стать белой вороной,0
что он есть в коллективе  что его нет,0
а куда тогда должен устраиваться омежка  где ему зарабатывать деньги на еду,0
или сразу в могилу,0
ну да,0
зачем тебе чувак  который воняет в офисе  не моет голову  и делает какие то странные вещи,0
он будет только всех раздражать,0
если допустим он кодит хорошо   то можно удаленно,0
и то   бытовое свинство есть показатель того  как человек работает в итоге   не в решении конкретных задач  тут он может ас   а вообще   на протяжении всего цикла,0
мужики глянь  патриот ебаный нарисовался,1
в общем  я считаю  что может надо немного полицемерить,0
всего лишь не называть их шлюхами при первой встрече и шанс на работу увеличивается на 3000%,0
или сразу в могилу,0
дис,0
если  ероха  на второй шебм прислал бы фотку себя в бомжацком свитере на фоне ковра облезлых обоев трупа бабы сраки из соседней комнаты то реакция была бы соответствующей,0
а так просто удачно подобраный свет  обстановка и камера телефона,0
на самом деле он так занят решением проблем в коде  что не успевает делать бытовые дела,0
ты только что проебал спеца который сидел бы за работой 24 7,0
почему в коллективе нельзя сохранять формальные отношения  обсуждая пути решения задач сухим и профессиональным языком  отдавая приоритет навыкам кодинга  а не навыкам общения с быдлом,0
мы с тобой о разных вещах спорим,0
я согласен с твоим описанием того  что должен делать лид,0
но я все еще не понимаю  зачем при этом нанимать на работу людей  с которыми в 90% будут проблемы,0
