она смотрит на твой ковёр на стене,0
да даже оставляя в стороне софскилсы  код  внезапно  пишется для других людей,0
читаемость кода   зачастую главная его характеристика,0
а как додик сможет написать простой и понятный для других код на языке программирования  если он не вывозит даже за коммуницирование посредством своего родного языка,1
понятный для других код на языке программированиякомментарии не завезли,0
как наличие комментариев отменяет то  что код пишется для других людей и должен быть для этих других людей простым и понятным,0
у этой шлюхи 3 тысячи друзей на фейсбуке,1
три тысячи,0
пиздец дегенератка,1
умение разбираться в чужом коде не завезли,0
что вообще за ебала  писание кода для других  это что конвейер  покодил   предай другому,0
или там текучка ебическая  что утром пишет один  в обед увольняется  вечером заканчивает другой,0
ну конечно такая баба никогда на работу задрота с мамкиных борщей не примит  такой типаж женщин яркий у них в подсознании отвращение ко всяким гикам  задротам и прочим маминым коризнам,0
её тупо корёжит от одного вида таких омег,0
я бы такую хрюшу уволил бы нахуй,0
щас бы блядь по фото в фейсбуках и коврам людей выбирать,0
вот прямо мгновенно бы выпиздил нахуй на мороз  говно ебанное  которое вред приносит  вместо того  чтобы пользу приносить  за что ей и платят в принципе,0
мимо дирехтор,0
прямо по фото видно что  у неё софтскилзы 88лвла прямо софтскиллзы прокачены просто до предела,0
есть пикрил ейных сосисей то,0
что такое софтскилзы,0
мягкие навыки иль навыки программирования,0
у парня с шариком  у парня с ковром у них точно нормальные фото,0
ну уж извините что не в костюме и на фоне мерседеса  но тем не менее лица их видно всё чётко ясно  у двух последних фото слишком далеко сделаны не разглядеть их лица чётко,0
умение продавать себя и вот это все навыки кабанчика  подскочить  вопросик обкашлять ладить с коллективом ну здесь двачую  может там нищая омега превозмогатор которая с бабкой живёт в одной комнате и тут попросил эту самую бабку себя сфоткать чтобы в айти вкатиться  а над ним потом угорают,0
сколько ей лет,0
по виду под полтинник,0
умение разбираться в чужом коде не завезли,0
вот для того  чтобы с ним не нужно было разбираться  он и должен быть простым и понятным,0
что вообще за ебала  писание кода для другихработа программиста называется,0
ладить с коллективомто есть получается коллектив априори говно,0
какая разница  она всё равно не возьмёт ни тебя  ни меня на работу,0
блядь  еще я сгорел нахуй от ее отступления про свадебные фото и фото с детьми мол  ну мы девачки попиздим на кого дочка похожа  но фото не запомним,0
блядь  дно пробито,0
ты нахуй хрюша  специалистом должна быть  не должны под тебя подстраиваться и мол  свадебные фото тебя отвлекают   ну ахуеть  че несет  пизда  то есть она прямо тут на камеру и перед аудиторией расписывается в том  что она абсолютно тотально некомпетентна как специалист по кадрам,1
охуеть,0
пизда некомпетентная просто совсем берега попутала,1
она на полном серьезе запрягает о том  какие фото ставить  а какие нет только потому что те фото заставят ее о том подумать  а эти   об этом  это подпись под тем  что она абсолютно некомпетентный специалист я жи девачка,0
но фото не запомнимно имя не запомним быстрофикс,0
типичная тупорылая шалава,1
собственно её кроме hr больше никуда и не возьмут,0
именно,0
помню на одной работе работал и там я тупо пришёл здравствуй пока со всеми и общался строго по работе,0
так пидорахи начали крыситься на меня  подкалывать в итоге мне сказали что я с коллективом не поладил а что это за хуйня такая когда ты просто себя ведёшь нормально  работаешь  ни хамишь  не грубишь и становишься изгоем и типа в этом виноват,1
вот это коллектив гавно  какая то зона ёбаная или армия где надо ставить себяодно дело когда зашёл в коллектив сразу сказал всем что они гавно и пидоры  а ты дартаньян это действительно не поладил,0
самое хуёвое  что эта тупая пизда уже и не будет нуждаться в другой работе,1
будет торговать этой хуйнёй  типа она дохуя в людях разбирается и может крутых спецов найти  у неё же своё целое агенство,1
работа программиста называется,0
если программист постоянно на созвоне с заказчиком  внутренним или сторонним   то у вас плохо организован рабочий процесс,0
в нормальных местах программисту дается тз и он по нему работает,0
тз разрабатывает методолог координатор  короче сотрудник  который должен переговорить с заказчиком  программистом и всех их подружить,0
он следит за процессом  перед тем как отдать он все проверяет на предмет соответствия и т,0
д,0
она всё равно не возьмёт ни тебя  ни меня на работуну да  бабы эйчары подбирают себе мужиков  а не сотрудников в фирму,0
шебм,0
её реакция на омежек,0
шебм,0
её реакция на ероху,0
нет  у неё реакция на говнофото и нормальные фото,0
чуваки с первого видео могли сделать нормальные фотографии с нормальным освещением  а не на фоне бабушкиной квартиры или ковра в полумраками и засветами,0
даже тупо селфи можно лучше сделать  если некого попросить сфоткать со стороны,0
даже если ты живёшь в убитой квартире в самом всратом городе  всегда можно найти хоть одно нормальное место для фото   кафешку  парк  универ  офис и т,0
д,0
это вопрос в том  чтобы поратить на фото полчаса  а не одну минуту,0
только и всего,0
либо  омежки  пиздец ленивые  но тогда за что им платить 300кк нсек   либо совсем асоциалы  которые не осознают всратость фото  но такие ещё и не моются неделями и козявки из носа ковыряют   работать рядом с ними будет тупо неприятно остальным членам команды,1
если программист постоянно на созвоне с заказчиком  внутренним или сторонним   то у вас плохо организован рабочий процесс,0
какого заказчика нахуй,0
речь идет о других программистах,0
она фактически работает в кадровом агентстве,0
еще в середине 2000 это было дно для биомусора,0
был её профиль в треде   там какие то олдспанкеры ей хвалебные дифирамбы пишут,0
все закономерно  она выглядит как климактеричка  у которой бешенство матки,1
но  кроме старых пердунов она нахуй никому не нужна,1
я бы такую хрюшу уволил бы нахуй,1
щас бы блядь по фото в фейсбуках и коврам людей выбирать,0
вот прямо мгновенно бы выпиздил нахуй на мороз  говно ебанное  которое вред приносит  вместо того  чтобы пользу приносить  за что ей и платят в принципе,0
мимо дирехторпроиграла,0
какой ты директор,0
ты омежка  который стреляет по мамке и быдлу за окном из невидимых пистолетов,0
чел  ты несешь хуйню  это их личные фото в пейсбуке  че хотят  то и выставляют,0
потоньше,0
хрюша баба с фамилией ёлкин из эстонии копается в резюме сисадминови кому на это все не поебать,1
ёлкин  я тоже с этой фамилии проиграл кстати,0
у неё там ещё джава вротэнды,0
свадебные фото тебя отвлекаюттут то все правильно  семейно положение указано в тексте  а резюме это не профиль в соцсетях  фото должно быть соответствующее  без лишних людей как минимум,0
ты с женой что ли работать будешь,0
потом что за нах  единственен приличное фото со свадьбы только,0
в ебаной эстонии у нее могут быть хоть разгонятели нейтронов без коллайдера,0
кого это ебет  повторяю,0
чел  если хрюша заворачивает потенциального кандидата в погроммисты  которому не с людьми на ресепшне общаться  заворачивает не по набору его качеств  нужных для работы  а по фото с ковром в пейсбуке  то она не просто некомпетентна  она приносит вред вместо пользы и прожирает ресурсы компании,1
у меня только один вопрос: а кто и зачем к резюме фото прикрепляет,0
это какая то чисто эстонская фишка,0
как же горит с этих резюме,0
ты будешь работать или выпездываться с этими ебаными резюме,1
вывод таков: хорошая фирма та  в которой похуй на резюме,0
речь идет о других программистах,0
программисты что пишет код  отдает другому тот дописывает  потом третий  потом четвертый  так что ли,0
чтобы каждый не лепил свою дуду  общие вопросы оговариваются заранее,0
лол  гречневый разнорабочий порвался,0
ну так не рвись,0
держи себя в руках,0
ок  вот она отобрала 5 кандидатов по опыту и навыкам и дает эти 5 резюме начальнику  ей пофиг на ковры,0
а начальник возьмет ковровому кандидату поставит в конец списка  т,0
е,0
звонить  если 4 откажутся,0
поясняю для долбоебов,1
эта баба работает в фирме  пытающейся продавать чужие резюме,0
вся ее деятельность   найти резюме на каком нибудь хх,0
ру  привести чувака за ручку в компанию  которая разместила вакансии на том же хх,0
ру  и взять деньги с обеих сторон,0
поскольку  очевидно  такая деятельность не сильно востребована  ей приходится собирать семинары и конференции  где она продает свой еблет под соусом  смотрите  какая я охуенная  дайте мне денег,1
вся эта хуйня сродни зумершам из тиктока,1
обращать на них внимание довольно странно,0
у меня только один вопрос: а кто и зачем к резюме фото прикрепляет,0
резюме без фото не рассматриваемопыт работы по трудовой книжке программистом 1 категории строгокрасный диплом строго,0
я серьезный вопрос задал,0
твои маняфантазии неуместны,1
привести чувака за ручку в компаниюкомпания может у нее заказать услуги по подбору,0
кому то так удобнее  чем держать свой штат нахлебников,0
резюме без фото посмотрят в последнюю очередь,0
ты будешь работать или выпездываться с этими ебаными резюме,1
если у человека не хватает ума составить более менее грамотное резюме и прикрепить нормальное фото  а не с котом у ковра  то с чего стоит полагать  что он сможет нормально выполнят трудовые обязанности,0
он с простейшими  базовыми вещами справится не может,0
что за бред ты несешь,1
ты блядь шебм в оп посте смотрел,1
мы конкретно об этом,0
профессионалу hr должно быть насрать какие фото у поциента в пейсбуке  его софт скилы проверяются на живом собеседовании и на испытательном сроке,0
хочет котиков  хочет ковры   его дело,0
пусть хоть фотки в коме с бухалова выставляет и цитатки с удава   не ее собачье блядь дело вообще  она нахуй не бойфренда себе выбирает  пизда некомпетентная  заигравшаяся в вахтера  ее задача   найти сотрудника компании  наиболее эффективного за определенный бюджет и в краткие сроки,0
а че там ей ковры не нравится или блядь котики   никого ваще ебать не должно,1
профессионал именно что должен от этого всего абстрагироваться  я еще раз напоминаю   идет поиск сотрудника  а не ебаря хрюши в тиндере,0
и положительная рекомендация по месту жительства обязательно,0
компания может у нее заказать услуги по подбору,0
компания имбецилов   может,0
хочешь ли ты работать в компании имбецилов,0
если нормальная компания аутсорсит подбор персонала  она  компания  сперва убедится в компетентности того  кому она аутсорсит,0
заставит сплясать с используемыми методиками и протестирует на паре тройке позиций,0
очевидно  что как только эта дурочка расскажет  ну  вот нам с девочками не понравилась фотка   ее сразу пошлют на хуй,1
твое резюме не посмотрят вообще  потому что ты не в состоянии прочесть несколько слов,0
зато любишь срать ртом,1
на картинке рекрутинг,0
проиграл  а ведь действительно,0
что за бред ты несешь,0
ты блядь шебм в оп посте смотрел,0
это гипотетическая ситуация  когда эйчару похуй на фотки   только компетенции,0
все равно есть начальник  который и на фото посмотрит и другие свои симпатии проявит  например  100% он возьмет кандидата из вуза  где сам учился при прочих равных достоинствах  хотя эйчару перечислил список вузов  которые подходят,0
если для тебя прикрепление фото к резюме эстонская фишка  то ты скорее всего безработный вот уже лет 15,0
чувак на фоне ковра расчитывал  что оценивать будут его профессиональные качества  а не талант его фотографа,0
фото нужно только для того  чтобы кадровичке было проще встретить тебя в фойе,0
буду пожалуй впредь тоже ставить фотку на фоне ковра  чтобы не тратить свое время на тупых пезд,0
ну а у hr есть личное дело   брать или не брать кандидата,0
если предполагается командная работа  от от программиста требуется некий минимальный набор софт скиллов,0
нет  не соблазнять в день по 10 тянок  а просто неотталкивающе выглядеть,0
иногда стричься  мыться чаще раза в неделю  одеваться не в лохмотья,0
это всё доступно любому  если он не инвалид с дцп,0
не нужно иметь рост 2,0
5 метра  член полметра и чадовскую челюсть,0
фото точно также показывает осознание и принятий базовых принципов социума,0
не требуется делать фото на фоне эльфеевой башни или в салоне личного бизнес джета,0
не требуется носить костюм от гуччи,0
но элементарная аккуратность вида  приятно подобранный фон,0
это вопрос траты получаса вместо одной минуты,0
если чел не смог раз в жизни потратить полчаса на нормальное фото  то есть хороший шанс  что тратить суммарно пару часов в неделю на душ он тем более не осилит,0
и в каком месте айти приближено к бизнесу  долбоеб,1
в программисте главное это хард скилы  и пусть он даже внешне выглядит как бомж и воняет перегаром  все равно при найме у него будет преимущество перед вылизанным сойбоем со сквозняком к черепной коробке,0
стартап лид фидбек спринты митинги дейликабанчик  ты хули то в треде похрюкиваешь,1
у тебя там через 5 минут брйек заканчивается  давай пиздуй,1
замотался парнишка,0
большей хуеты еще не видел,1
ну а у hr есть личное дело   брать или не брать кандидата,0
это не личное дело  это профессиональная обязанность,0
если она возьмет социального альфача  который будет говнокодить вместо омежкина  рожденного  чтобы кодить   она принесет фирме ущерб  вполне себе финансовый,0
есть профессиональное соответствие  именно его должны оценивать в первую очередь,0
а своей женской хуйней пусть в свободное время занимается,1
но ведь фото были не в фейсбуке  а в резюме,0
профессионалу hr должно быть насрать какие фото у поциента в пейсбуке  его софт скилы проверяются на живом собеседовании и на испытательном сроке,0
хочет котиков  хочет ковры   его дело,0
пусть хоть фотки в коме с бухалова выставляет и цитатки с удава   не ее собачье блядь дело вообще  она нахуй не бойфренда себе выбирает  пизда некомпетентная  заигравшаяся в вахтеране бомби  омеж,1
теперь что  каждое быдло с фотографиями с бухалова и шутками в резюме звать на собеседование,1
продублирую:если у человека не хватает ума составить более менее грамотное резюме и прикрепить нормальное фото  а не с котом у ковра  то с чего стоит полагать  что он сможет нормально выполнят трудовые обязанности,0
он с простейшими  базовыми вещами справится не может,0
это самый начальный этап отбора,0
тут и решается пойдет ли дальше твоё резюме,0
если человек этого не понимает  то он либо настолько преисполнился и перешел на иное состояние бытия  либо просто дегенерат,0
