двач,0
был её профиль в треде   там какие то олдспанкеры ей хвалебные дифирамбы пишут,0
все закономерно  она выглядит как климактеричка  у которой бешенство матки,0
но  кроме старых пердунов она нахуй никому не нужна,1
мимо дирехторпроиграла,0
какой ты директор,0
ты омежка  который стреляет по мамке и быдлу за окном из невидимых пистолетов,1
чел  ты несешь хуйню  это их личные фото в пейсбуке  че хотят  то и выставляют,1
потоньше,0
хрюша баба с фамилией ёлкин из эстонии копается в резюме сисадминови кому на это все не поебать,1
ёлкин  я тоже с этой фамилии проиграл кстати,0
у неё там ещё джава вротэнды,0
свадебные фото тебя отвлекаюттут то все правильно  семейно положение указано в тексте  а резюме это не профиль в соцсетях  фото должно быть соответствующее  без лишних людей как минимум,0
ты с женой что ли работать будешь,0
потом что за нах  единственен приличное фото со свадьбы только,0
в ебаной эстонии у нее могут быть хоть разгонятели нейтронов без коллайдера,1
кого это ебет  повторяю,1
чел  если хрюша заворачивает потенциального кандидата в погроммисты  которому не с людьми на ресепшне общаться  заворачивает не по набору его качеств  нужных для работы  а по фото с ковром в пейсбуке  то она не просто некомпетентна  она приносит вред вместо пользы и прожирает ресурсы компании,1
у меня только один вопрос: а кто и зачем к резюме фото прикрепляет,0
это какая то чисто эстонская фишка,1
как же горит с этих резюме,0
ты будешь работать или выпездываться с этими ебаными резюме,1
вывод таков: хорошая фирма та  в которой похуй на резюме,1
программисты что пишет код  отдает другому тот дописывает  потом третий  потом четвертый  так что ли,0
чтобы каждый не лепил свою дуду  общие вопросы оговариваются заранее,1
лол  гречневый разнорабочий порвался,1
ну так не рвись,1
держи себя в руках,0
ок  вот она отобрала 5 кандидатов по опыту и навыкам и дает эти 5 резюме начальнику  ей пофиг на ковры,0
а начальник возьмет ковровому кандидату поставит в конец списка  т,0
е,0
звонить  если 4 откажутся,0
поясняю для долбоебов,1
эта баба работает в фирме  пытающейся продавать чужие резюме,0
вся ее деятельность   найти резюме на каком нибудь хх,0
ру  привести чувака за ручку в компанию  которая разместила вакансии на том же хх,0
ру  и взять деньги с обеих сторон,0
поскольку  очевидно  такая деятельность не сильно востребована  ей приходится собирать семинары и конференции  где она продает свой еблет под соусом  смотрите  какая я охуенная  дайте мне денег,1
вся эта хуйня сродни зумершам из тиктока,1
обращать на них внимание довольно странно,0
резюме без фото не рассматриваемопыт работы по трудовой книжке программистом 1 категории строгокрасный диплом строго,0
я серьезный вопрос задал,0
твои маняфантазии неуместны,0
привести чувака за ручку в компаниюкомпания может у нее заказать услуги по подбору,0
кому то так удобнее  чем держать свой штат нахлебников,1
резюме без фото посмотрят в последнюю очередь,0
если у человека не хватает ума составить более менее грамотное резюме и прикрепить нормальное фото  а не с котом у ковра  то с чего стоит полагать  что он сможет нормально выполнят трудовые обязанности,0
он с простейшими  базовыми вещами справится не может,0
что за бред ты несешь,1
ты блядь шебм в оп посте смотрел,1
мы конкретно об этом,1
хочет котиков  хочет ковры   его дело,0
пусть хоть фотки в коме с бухалова выставляет и цитатки с удава   не ее собачье блядь дело вообще  она нахуй не бойфренда себе выбирает  пизда некомпетентная  заигравшаяся в вахтера  ее задача   найти сотрудника компании  наиболее эффективного за определенный бюджет и в краткие сроки,1
а че там ей ковры не нравится или блядь котики   никого ваще ебать не должно,1
профессионал именно что должен от этого всего абстрагироваться  я еще раз напоминаю   идет поиск сотрудника  а не ебаря хрюши в тиндере,1
и положительная рекомендация по месту жительства обязательно,0
компания может у нее заказать услуги по подбору,0
компания имбецилов   может,0
хочешь ли ты работать в компании имбецилов,1
если нормальная компания аутсорсит подбор персонала  она  компания  сперва убедится в компетентности того  кому она аутсорсит,0
заставит сплясать с используемыми методиками и протестирует на паре тройке позиций,0
очевидно  что как только эта дурочка расскажет  ну  вот нам с девочками не понравилась фотка   ее сразу пошлют на хуй,1
твое резюме не посмотрят вообще  потому что ты не в состоянии прочесть несколько слов,1
зато любишь срать ртом,1
на картинке рекрутинг,0
проиграл  а ведь действительно,0
это гипотетическая ситуация  когда эйчару похуй на фотки   только компетенции,1
все равно есть начальник  который и на фото посмотрит и другие свои симпатии проявит  например  100% он возьмет кандидата из вуза  где сам учился при прочих равных достоинствах  хотя эйчару перечислил список вузов  которые подходят,1
если для тебя прикрепление фото к резюме эстонская фишка  то ты скорее всего безработный вот уже лет 15,1
чувак на фоне ковра расчитывал  что оценивать будут его профессиональные качества  а не талант его фотографа,0
фото нужно только для того  чтобы кадровичке было проще встретить тебя в фойе,0
буду пожалуй впредь тоже ставить фотку на фоне ковра  чтобы не тратить свое время на тупых пезд,1
если предполагается командная работа  от от программиста требуется некий минимальный набор софт скиллов,0
нет  не соблазнять в день по 10 тянок  а просто неотталкивающе выглядеть,1
иногда стричься  мыться чаще раза в неделю  одеваться не в лохмотья,1
это всё доступно любому  если он не инвалид с дцп,1
не нужно иметь рост 2,0
5 метра  член полметра и чадовскую челюсть,1
фото точно также показывает осознание и принятий базовых принципов социума,0
не требуется делать фото на фоне эльфеевой башни или в салоне личного бизнес джета,1
не требуется носить костюм от гуччи,1
но элементарная аккуратность вида  приятно подобранный фон,0
это вопрос траты получаса вместо одной минуты,0
если чел не смог раз в жизни потратить полчаса на нормальное фото  то есть хороший шанс  что тратить суммарно пару часов в неделю на душ он тем более не осилит,1
и в каком месте айти приближено к бизнесу  долбоеб,1
в программисте главное это хард скилы  и пусть он даже внешне выглядит как бомж и воняет перегаром  все равно при найме у него будет преимущество перед вылизанным сойбоем со сквозняком к черепной коробке,1
стартап лид фидбек спринты митинги дейликабанчик  ты хули то в треде похрюкиваешь,1
у тебя там через 5 минут брйек заканчивается  давай пиздуй,1
замотался парнишка,0
большей хуеты еще не видел,1
это не личное дело  это профессиональная обязанность,0
если она возьмет социального альфача  который будет говнокодить вместо омежкина  рожденного  чтобы кодить   она принесет фирме ущерб  вполне себе финансовый,1
есть профессиональное соответствие  именно его должны оценивать в первую очередь,0
а своей женской хуйней пусть в свободное время занимается,1
но ведь фото были не в фейсбуке  а в резюме,0
пусть хоть фотки в коме с бухалова выставляет и цитатки с удава   не ее собачье блядь дело вообще  она нахуй не бойфренда себе выбирает  пизда некомпетентная  заигравшаяся в вахтеране бомби  омеж,1
теперь что  каждое быдло с фотографиями с бухалова и шутками в резюме звать на собеседование,1
продублирую:если у человека не хватает ума составить более менее грамотное резюме и прикрепить нормальное фото  а не с котом у ковра  то с чего стоит полагать  что он сможет нормально выполнят трудовые обязанности,0
это самый начальный этап отбора,0
тут и решается пойдет ли дальше твоё резюме,0
если человек этого не понимает  то он либо настолько преисполнился и перешел на иное состояние бытия  либо просто дегенерат,1
и не важно кодит ли он с пеленок  или мастер изготовления стеклянных дилдо,0
пиздеееец,1
как так  анон  что за рак хр отрасли,1
ониж трансконтинентальные нахуй  гоустинг после собеседований ебанутые вопросы  а теперь и прямое подтверждение  что хр оценивает самцовость а не навыки,1
да мне насрать на твои гипотетические ситуации и прочие твои маневры сракой,1
конкретно эта хрюша   хуита некомпетентная  показывающая нулевую компетенцию  еще и заигравшаяся при выборе сотрудника  попутав с выбором себе ебыря в тиндере,1
ковры блядь ей не нравятся в пейсбуке  ну охуеть,1
а мне всратые типа нее не нравятся,0
жирные всратые пезды,1
но заикнись я  что не буду таких брать   визга будет ояебал,1
но я  к счастью  не такая тупая пизда  у меня помощник руководителя   довольно всратая тяночка еще и жирноватая,1
секретарь  правда  няшная  но так случайно вышло  не выбирал по внешности,1
а пизда вполне себе нормально доебывается до фото в песбуке ссаном типа ковер  котэ или слишком далеко сел мол  вот лох  фоткаться не умеет    ну это блядь пиздец нахуй,1
я реально охуеваю  сталкиваясь с подобной вопиющей некомпетентностью  за которую еще и бабки платят  лол,1
не удивительно  что в каждой второй компании все через пизду,1
подобные шлюхи понабирают всякого кабанчикового мусора с подвешенным языком и без мозгов  а сычи со скиллом сосут хуй  потому что у них свитер мамин,1
с котом у коврая и большинство моих коллег  программистов с большим опытом  крайне позитивно бы отнеслись к такой фотографии,1
ведь он такой же как и мы,0
а самоуверенный альфач как на 2 фотке скорее всего будет вести себя как самодовольный мудила,0
и как с таким работать в команде,0
охуеть  тупая пизда  а как ты связал фото с ковром и то  что человек не моется,1
мне даже любопытна твоя логика  долбоеб  проясни  пожалуйста  как фото 1  с ковром 2  с котэ 3  неудачно далеко сидит лох  фоткаться не умеет       вот как эти фото говорят что он не моется или он в лохмотьях или блядь еще что,0
ты долбоеб,1
решение кого нанимать принимает не она  а начальник подразделения  куда ищется сотрудник,0
потом этот начальник сам поведет соискателя к своему начальнику  чтобы тот одобрил,0
в чем проблема,0
хрюша привела кандидата  он устроил всех начальников и его наняли  ну а если оказалось  что он говнокодит  то сами виноваты,1
а к 4 ому где чувак с шариком я вообще не понимаю в чём претензия,0
омеж тут только ты  а я сотней людей руковожу,1
мой лук рабочий 400к стоит  а машина   5,1
5 млн  но блядь  я бы выгнал нахуй ту хрюшу  что отказала соискателю на основании наличия у него неудачных по ее мнению фоток в пейсбуке типа ковер  котэ и прочее,1
ну типа пизда проиигрывает шо типа всратенький омежный,1
на себя бы в зеркало взглянула  че,0
крайне позитивно бы отнеслись к такой фотографии,0
ну так обозначь это в требованиях   фото должно быть не банальное постановочное в костюме  а с котом на фоне ковра,1
смотри  хрюша проводит первоначальный отбор,1
если она изначально отсеяла 90% скилловых кандидатов  потому что они не альфачи  а позвала на собесы всяких дебилоидов с красивой внешкой  то техническим собеседующим придется иметь с этим дело,1
и они такими темпами могут искать нужного кандидата месяцами,0
и вот она  такая вся охуенная  каждый раз такой хуйней страдает,1
а вот начальник решает воспользоваться услугами незвисимого рекрутингово агентства  у которого несколько иные критерии отбора,0
и хоба   тут же  за пару недель вся команда укомплектована,0
хрюша  зазывающая альфачей тут же посылается нахуй  а сотрудничество идет с рекрутинговым агентством,1
проблема лишь в том  что начальство не всегда уделяет этому внимание  а у хрюш появляется синдром вахтера,1
а я сотней людей руковожу,0
5 млни поэтому ты оправдываешься на анонимном форуме в воскресенье вечером,0
дело ведь не в соблюдении требований  а в личности  в том  как человек себя ведет в тех случаях  когда четких требований нет,0
именно это и показывает  какой на самом деле он человек,0
если она изначально отсеяла 90% скилловых кандидатовтебе не похуй кого она там отсеяла,1
чтобы время сократить   связывайся сам с каждым и переговаривай  поймешь кого звать на очную встречу,0
ну  в какой то нонейм айти параше  ещё и в нищей приебалтике  тупая пизда сидит и оценивает будущих сотрудников по внешке,1
очевидно  что контора это днищенская и как она там организовывает подбор сотрудников это её внутрикорпоративное дело,1
почему мне должно быть не похуй,1
кабанчики охуенны же,1
они умеют ладить с коллективом и вообще прекольные,0
тебе не похуй кого она там отсеяла,1
если бы я отвечал за проект  конечно же мне не похуй  на кого я буду тратить своё время  блядь,1
я не хочу тратить его впустую  время   деньги  слышал о таком,0
потому что социальные навыки   это тоже навыкиработа   это коллективное мероприятие  где все вынуждены органично с собой сосуществовать,0
если человек не умеет сосуществовать в коллективе  никакая гениальность его не оправдает,1
к тому же  фото   это только первый фильтр  не единственный,0
есть ещё куча других фильтров  проверяющих рабочие навыки на практике  начиная от списка навыков в резюме и заканчивая испытательным сроком,1
если она изначально отсеяла 90% скилловых кандидатов  потому что они не альфачискилловый кандидат  знаток погромирования  знает от и до джаву  хуяву  окуджаву,0
не может написать резюме и сделать нормальное фото на документы в любом салоне  фото на документы,1
