двач,0
не про формальные а про приятельское а если омежка   гений кода,0
ну вот скажи может ли считаться кто то мега гуру если у него мало звезд и форков в гитхабе,0
этой соцсети для программистоввсе как в жизни,0
больше социоблядь значит лучше как профессионал,1
на оборотты бы лучше уроки делал  раскрепоститель,0
топовый разработчик это только социоблядьты слишком тупой  чтобы понять  что у тебя ошибка выжившего,1
может где то в деревне сидит битард  который уже код к машине времени написал  только ты про него никогда не узнаешь  а узнаешь про васяна гыгыкающего  который на конференция лыбу тянет,1
а если омежка   гений кодаа нахуй ему коллектив тогда,1
пусть не выебывается и пойдет по пути перельмана,1
вот по этому ты и омежка  если доёбываешься до такой хуйнимимо,1
все как в жизни,1
больше социоблядь значит лучше как профессионаллол блять,1
какой же ты дегенрат,1
а если омежка   гений кода,1
допустим,0
но у него нет контакта с другими разрабами  командами,0
он не использует их решения  или не знает о них потому что не общается либо считает себя гением и что они сделали говно,1
он не переиспользует чужой код  его код не переиспользуютодин гений кода не потянет проект  каким бы гением он не был,1
по этомутолсто,0
точку в конце поставь  толстый,1
я макакокодер 250кк ннсек все как в жизни,0
больше социоблядь значит лучше как профессионалгде аргументы то,1
уважаемые веб макаки сеньеры и мидлы,0
какие еще алгоритмы нужны и под что,0
битард  который уже код к машине времени написалили не написалесли написал так пусть показывает это на конференциях  другие программисты оценят,0
топовый разработчик это тот который дохуя ходит на конференции  делает доклады  круглые столыда нихуя,1
топовый разработчик это тот  кто участвовал в создании какой нибудь топовой приблуды  либо сам ее сговнокодил с 0,1
ебальником светить на конфах абсолютно необязтально  если ты не собираешься конечно работать пиар менеджером или каким нибудь евангелистом,1
ну вот перельман показал  да и то под давление вероятно  раз даже от награды отказался,1
а оказался умнее всех по сути в своей теме,0
так что твоя хуйня тупя про социоблядство не верна вообще,1
гугли блять эффект данинга крюгера,1
сейчас 90% планеты живёт по сути на этой хуйне  довены подсасывают довенам,1
получается когнитивное искажение  примерно как у баб  у которых чсв до небес  потому что с малых сотни подсосов,1
вот и у тебя такое же искажение очевидно,1
у многих большинства прогеров точно,1
вынимай хуй из рта хоть изредка  совет тебе отеческий,1
перельмана бы хрюша забраковала  выглядит как фрик же,1
софт скиллзы отсуствуют,0
как показывает практика  на средне долгой дистанции от таких фриков мало толку проекту,0
решать какую то одну задачу  затратив на нее много лишнего времени для  оптимизации    это он может быть и может  а всего остального   нет  типа там  сдавать вещи вовремя  согласовывать всё с командой  объяснять свои действия на человеческом языке итд,0
выгоднее взять человека который работает размеренно  отдыхает на выходных и дела содержит в порядке,0
отчасти согласен,0
но все же хоть немного ебальником светить надо  чтобы верифицировать топовость однако он все таки публиковал статьи которы читали,0
для этого все же хоть немного надо быть социоблядьюи также разьежжал по европе по конференциям и светил ебальником  жил в швецарии итд,1
алсо  блять ещё тебе нассу в ротеш,1
ты же супер умный  всё знаешь,1
знаешь наверно такого персонажа александр невский мистер вселенная,0
знаешь конечно,1
а алексея нетесанова знаешь,1
не знаешь ты конечно нихуя,1
так вот у алексея нетесанова самый настоящий титул мистер олимпия  который был у шварца 6 раз,0
только никто этого толком не знает  потому что он не социоблядь ебучая  которая везде своей мордой лезет  на конференции  блять,1
однако он лучший,0
твой задроченный джун без софтскилзов будет месяц делать хуйню  потому что ему стыдно спросить  как делать правильно,1
жиза  сколько так раз увольнялся  где то месяц  где то неделя  рекорд 2 дня и 1 час третьего,0
а все потому что спросишь и думают  что тупой и сразу уволят  изи  а так хотя бы за месяц получить 50к  посидев в офисе как белый человек  все равно потом идти в курьеры за двадцатку,1
думаю те кто в теме и интересуются этим конкурсом знают про него  и уважают в отличии от невского,0
так что это социоблядь,1
ну спарведливости ради я соглашусь что фрики действительно в качестве наёмных работников в 80% случаев плохие,0
но это не знаит что фрики гавно  фрики очень часто создают что то иннваиционное  своё так сказать,1
ты тоже не знаешь всяких разных топовых программистов,1
но наверняка зато ты знаешь всяких фриков типа  болгенос,1
тут вообще никто не спорит  просто редко это происходит в случае когда нужна размеренная и слаженная командная работа,0
поэтому фрикам больше идёт стать каким нибудь спецом топ 1% либо пилить свой собственный пет проект который взлетит,1
иначе никак,0
а в бизнесе айти нужны среднего ума люди которые буду срать говнокодом в срок,1
по сути в бизнесе не важна оптимизация  главное в срок сделать и чтобы функционал заявленный был  а если оно ещё и с багами будет кому то даже лучше  можно будет даже доп,0
деньги с клиента брать за фикс говна,1
я не знаю  да,0
в таком случае откуда хра то вообще хоть что то знать о человеке,1
проверка соцсетей это вообще дегенератизм,1
я ими не пользуюсь  однако  когда работал  то все охуевали какой я ниибаца отвественный,1
а это потому что я перфекционист с окр,0
а твой нормис понос ебаный  за которым я всё время всё доделывал  но зато у него 250 друзей и дидываивали на стеночке,1
а все потому что спросишь и думают  что тупой и сразу уволятчувак  никто не ожидает от джуна особого скила,1
если джун не спрашивает   это неправильный джун,0
проблемы будут если все время спрашивать одно и то же,0
болгенос это как раз не фрик а кабанчик,1
а уж его стеки где он вписывал все яп и фреймы которые знает я молчу,1
чувак научился редактировать строчные переменные в коде и конфигурации и продал кабанчиком это как супер пупер нанось,1
был бы чуть по взрослее и если бы руководствовался не чсв  а наживой к успеху бы пришёл,1
дидываивале   двачер с окресли бы не диды нас бы не был  а если бы не двачер то у нас было бы  1 рабочее место для сына тёти сраки из бухгалтерии,1
рили,1
то у нас было бы  1 рабочее место для сына тёти сраки из бухгалтерииэто работает только если фирма не ориентирована на прибыль,1
в небольшой коммерческой конторе сына тети сраки пойдет нахуй если не будет выдавать приемлемый результат,1
тетя срака может пойти следом если будет выебываться и мутить коллектив,1
проверка соцсетей это вообще дегенератизмхр открывает профиль гитхаба,1
ебать он пилил либы с сотнями звездзначит он стоящий разраб  пишу во все соцсети,1
пирамида возможностей,1
хр открывает профиль гитхабанахуя тогда шаболда с вебм оценивает людей по ковру,1
ей не поебать,1
сама же сука тнус ебаный ведь  за 10 минут до этого выступления все ноги себе обоссала и дырку жопную,1
не чувак  у тебя манямир,1
в небольшой коммерческой конторе сыну тети сраки создадут рабочее место чисто под него,1
а двачеру урежут зарплату  скажут что щас проблемы в компании и вообще работать надо больше,0
а что с ковром не так,0
у россиян и так почти  нет никакого своего культурного кода  а ковры на стенах это хоть что то особенное,1
нет  давайте считать это зашкваром только потому что так не делают на западе,1
нахуя тогда шаболда с вебм оценивает людей по ковру,1
не ебу,1
если ли бы парень был умней он бы сделал резюме без фото  или с качественным фото  а не давал возможность всяким шаболдам себя оцеивать,1
мань  я работаю в небольших коммерческих конторах,1
так вот  создать рабочее место под сына тети сраки  можно в конторах размером с газпром или какой нибудь оракл  там от небольшого количества хуепинальщиков не просядет выручка в квартал у подразделения,1
а вот если у галеры рога и копыта у которой 8 заказчиков один из этих восьми скажет  чо у вас рабы такие тупые,1
может мне других макак поискать,1
это серьезно ударит по баблу,1
чувак  никто не ожидает от джуна особого скила,1
в вашем мире есть только джуны  лиды и разрабы,0
что у нее с говором,0
говна в ротеш набрали или что,1
мерзкое животное какое то,1
спасибо анон,0
сразу заблочил,0
старушенция,0
вновь пришедшим сотрудникам не всегда дают время раскачаться и войти в курс делазависит от того  что должен делать сотрудник и что он наговорил на собесе,0
я не могу представить себе чтобы кто то там ожидал от таксиста или какого нибудь разнорабочего на стройке  например  что он будет месяц  раскачиваться и входить в курс дела,0
нет  я для красного словца немного припиздел,1
зависит от того  что должен делать сотрудник и что он наговорил на собесе,0
речь про вакансии  на которые можно было придти без релевантного опыта  начинающий или помощник специалиста нейм,0
старушенция какашенция,1
да ладно  первое слово дороже второго,0
первое слово съела корова,0
она смотрит на твой ковёр на стене,0
да даже оставляя в стороне софскилсы  код  внезапно  пишется для других людей,0
читаемость кода   зачастую главная его характеристика,0
а как додик сможет написать простой и понятный для других код на языке программирования  если он не вывозит даже за коммуницирование посредством своего родного языка,0
понятный для других код на языке программированиякомментарии не завезли,0
как наличие комментариев отменяет то  что код пишется для других людей и должен быть для этих других людей простым и понятным,0
у этой шлюхи 3 тысячи друзей на фейсбуке,1
три тысячи,0
пиздец дегенератка,1
умение разбираться в чужом коде не завезли,0
что вообще за ебала  писание кода для других  это что конвейер  покодил   предай другому,1
или там текучка ебическая  что утром пишет один  в обед увольняется  вечером заканчивает другой,1
ну конечно такая баба никогда на работу задрота с мамкиных борщей не примит  такой типаж женщин яркий у них в подсознании отвращение ко всяким гикам  задротам и прочим маминым коризнам,1
её тупо корёжит от одного вида таких омег,0
я бы такую хрюшу уволил бы нахуй,1
щас бы блядь по фото в фейсбуках и коврам людей выбирать,1
вот прямо мгновенно бы выпиздил нахуй на мороз  говно ебанное  которое вред приносит  вместо того  чтобы пользу приносить  за что ей и платят в принципе,1
мимо дирехтор,0
прямо по фото видно что  у неё софтскилзы 88лвла прямо софтскиллзы прокачены просто до предела,0
есть пикрил ейных сосисей то,1
что такое софтскилзы,0
мягкие навыки иль навыки программирования,0
у парня с шариком  у парня с ковром у них точно нормальные фото,0
ну уж извините что не в костюме и на фоне мерседеса  но тем не менее лица их видно всё чётко ясно  у двух последних фото слишком далеко сделаны не разглядеть их лица чётко,1
умение продавать себя и вот это все навыки кабанчика  подскочить  вопросик обкашлять ладить с коллективом ну здесь двачую  может там нищая омега превозмогатор которая с бабкой живёт в одной комнате и тут попросил эту самую бабку себя сфоткать чтобы в айти вкатиться  а над ним потом угорают,1
сколько ей лет,0
по виду под полтинник,1
вот для того  чтобы с ним не нужно было разбираться  он и должен быть простым и понятным,0
что вообще за ебала  писание кода для другихработа программиста называется,1
ладить с коллективомто есть получается коллектив априори говно,1
какая разница  она всё равно не возьмёт ни тебя  ни меня на работу,1
блядь  еще я сгорел нахуй от ее отступления про свадебные фото и фото с детьми мол  ну мы девачки попиздим на кого дочка похожа  но фото не запомним,1
блядь  дно пробито,1
ты нахуй хрюша  специалистом должна быть  не должны под тебя подстраиваться и мол  свадебные фото тебя отвлекают   ну ахуеть  че несет  пизда  то есть она прямо тут на камеру и перед аудиторией расписывается в том  что она абсолютно тотально некомпетентна как специалист по кадрам,1
охуеть,1
пизда некомпетентная просто совсем берега попутала,1
она на полном серьезе запрягает о том  какие фото ставить  а какие нет только потому что те фото заставят ее о том подумать  а эти   об этом  это подпись под тем  что она абсолютно некомпетентный специалист я жи девачка,1
но фото не запомнимно имя не запомним быстрофикс,0
типичная тупорылая шалава,1
именно,0
помню на одной работе работал и там я тупо пришёл здравствуй пока со всеми и общался строго по работе,0
так пидорахи начали крыситься на меня  подкалывать в итоге мне сказали что я с коллективом не поладил а что это за хуйня такая когда ты просто себя ведёшь нормально  работаешь  ни хамишь  не грубишь и становишься изгоем и типа в этом виноват,1
вот это коллектив гавно  какая то зона ёбаная или армия где надо ставить себяодно дело когда зашёл в коллектив сразу сказал всем что они гавно и пидоры  а ты дартаньян это действительно не поладил,1
самое хуёвое  что эта тупая пизда уже и не будет нуждаться в другой работе,1
будет торговать этой хуйнёй  типа она дохуя в людях разбирается и может крутых спецов найти  у неё же своё целое агенство,1
работа программиста называется,0
если программист постоянно на созвоне с заказчиком  внутренним или сторонним   то у вас плохо организован рабочий процесс,0
в нормальных местах программисту дается тз и он по нему работает,0
тз разрабатывает методолог координатор  короче сотрудник  который должен переговорить с заказчиком  программистом и всех их подружить,0
он следит за процессом  перед тем как отдать он все проверяет на предмет соответствия и т,0
д,0
она всё равно не возьмёт ни тебя  ни меня на работуну да  бабы эйчары подбирают себе мужиков  а не сотрудников в фирму,0
шебм,0
её реакция на омежек,0
её реакция на ероху,0
нет  у неё реакция на говнофото и нормальные фото,1
чуваки с первого видео могли сделать нормальные фотографии с нормальным освещением  а не на фоне бабушкиной квартиры или ковра в полумраками и засветами,0
даже тупо селфи можно лучше сделать  если некого попросить сфоткать со стороны,0
даже если ты живёшь в убитой квартире в самом всратом городе  всегда можно найти хоть одно нормальное место для фото   кафешку  парк  универ  офис и т,0
это вопрос в том  чтобы поратить на фото полчаса  а не одну минуту,0
только и всего,0
либо  омежки  пиздец ленивые  но тогда за что им платить 300кк нсек   либо совсем асоциалы  которые не осознают всратость фото  но такие ещё и не моются неделями и козявки из носа ковыряют   работать рядом с ними будет тупо неприятно остальным членам команды,1
какого заказчика нахуй,1
речь идет о других программистах,0
она фактически работает в кадровом агентстве,0
еще в середине 2000 это было дно для биомусора,1
